{"$schema":"https://json-schema.org/draft/2020-12/schema","title":"Atlas AI Package Finder Rule","type":"object","required":["rule_id","segment","signal","recommended_package","risk_route","cta"],"properties":{"rule_id":{"type":"string"},"segment":{"enum":["business_professional","student","consumer_private_user","mixed"]},"signal":{"type":"string"},"recommended_package":{"type":"string"},"risk_route":{"enum":["Green","Amber","Red"]},"platform_lane_hint":{"type":"array","items":{"type":"string"}},"cta":{"type":"string"},"secure_review_required":{"type":"boolean"}}}
