[
  {"rule_id":"PF-BIZ-001","segment":"business_professional","signal":"team workflow, governance, internal knowledge or repeated professional documents","recommended_package":"team-workspace","risk_route":"Amber","platform_lane_hint":["openai","copilot","claude","gemini"],"cta":"Compare business packages","secure_review_required":false},
  {"rule_id":"PF-BIZ-002","segment":"business_professional","signal":"confidential files, protected artifacts, regulated-adjacent workflow or strict access control","recommended_package":"managed-secure","risk_route":"Red","platform_lane_hint":["azure-secure"],"cta":"Request architecture review","secure_review_required":true},
  {"rule_id":"PF-STU-001","segment":"student","signal":"exam planning, revision schedule, concept explanation or quiz generation","recommended_package":"study-planner-exam-coach","risk_route":"Green","platform_lane_hint":["openai","claude","gemini"],"cta":"Explore study support","secure_review_required":false},
  {"rule_id":"PF-STU-002","segment":"student","signal":"source finding, citation, research synthesis or source criticism","recommended_package":"source-research-coach","risk_route":"Green","platform_lane_hint":["perplexity","claude","openai"],"cta":"Explore source coaching","secure_review_required":false},
  {"rule_id":"PF-CON-001","segment":"consumer_private_user","signal":"daily planning, routines, checklists or personal productivity","recommended_package":"personal-life-organizer","risk_route":"Green","platform_lane_hint":["openai","gemini"],"cta":"Explore personal tools","secure_review_required":false},
  {"rule_id":"PF-CON-002","segment":"consumer_private_user","signal":"medical, legal, financial, mental-health companion or emergency use","recommended_package":"none_excluded","risk_route":"Red","platform_lane_hint":[],"cta":"Review safe-use boundaries","secure_review_required":true}
]
